{
  "schema_version": "1.0.0",
  "certificate_kind": "cybernetic_safety_case",
  "safety_case_id": "safety-case-tier1-demo",
  "created_at": "2026-05-11T00:00:00Z",
  "execution_status": "synthetic_fixture",
  "claim": "Tier 1 governance fixtures validate the schema composition path.",
  "scope": "Synthetic fixture lane only.",
  "evidence_receipt_refs": [{"evidence_receipt_id": "evidence-tier1-demo", "evidence_receipt_sha256": "cccccccccccccccccccccccccccccccccccccccccccccccccccccccccccccccc"}],
  "authority_chain_ref": {"authority_chain_id": "auth-chain-tier1-demo", "authority_chain_sha256": "aaaaaaaaaaaaaaaaaaaaaaaaaaaaaaaaaaaaaaaaaaaaaaaaaaaaaaaaaaaaaaaa"},
  "monitor_alert_refs": [{"monitor_alert_id": "monitor-alert-tier1-demo", "monitor_alert_sha256": "eeeeeeeeeeeeeeeeeeeeeeeeeeeeeeeeeeeeeeeeeeeeeeeeeeeeeeeeeeeeeeee"}],
  "off_history_refs": [{"off_history_id": "off-history-blocked-action-demo", "off_history_sha256": "dddddddddddddddddddddddddddddddddddddddddddddddddddddddddddddddd"}],
  "non_claims": ["Does not claim production runtime.", "Does not claim cryptographic receipt implementation."],
  "residual_risks": ["Runtime integration pending."],
  "ledger_entry": {"event_id": "safety-case-tier1-demo-event", "event_type": "safety_case_recorded", "created_at": "2026-05-11T00:00:00Z"}
}
